{
  "$schema": "https://json-schema.org/draft/2020-12/schema",
  "$id": "https://github.com/Compliatory/MedUI/schemas/0.3/profile-case.schema.json",
  "type": "object",
  "additionalProperties": false,
  "required": [
    "id",
    "profile",
    "rules",
    "description",
    "inputs",
    "expected"
  ],
  "properties": {
    "id": {
      "type": "string",
      "pattern": "^MEDUI-PROFILE-CASE-[A-Z0-9-]+$"
    },
    "profile": {
      "type": "object",
      "additionalProperties": false,
      "required": [
        "id",
        "version"
      ],
      "properties": {
        "id": {
          "enum": [
            "MEDUI-PROFILE-RENDERED",
            "MEDUI-PROFILE-EVIDENCE",
            "MEDUI-PROFILE-INTERACTION",
            "MEDUI-PROFILE-BINDING",
            "MEDUI-PROFILE-PRESENTATION",
            "MEDUI-PROFILE-PIXELS"
          ]
        },
        "version": {
          "const": 1
        }
      }
    },
    "rules": {
      "type": "array",
      "items": {
        "enum": [
          "R01",
          "R02",
          "R03",
          "R04",
          "E01",
          "E02",
          "E03",
          "I01",
          "I02",
          "I03",
          "I04",
          "I05",
          "I06",
          "B01",
          "B02",
          "B03",
          "B04",
          "P01",
          "P02",
          "P03"
        ]
      },
      "minItems": 1,
      "uniqueItems": true
    },
    "description": {
      "type": "string",
      "minLength": 1
    },
    "inputs": {
      "type": "object",
      "required": [
        "operation"
      ],
      "properties": {
        "operation": {
          "enum": [
            "rendered-check",
            "aggregate-evidence",
            "normalize",
            "hit",
            "edit",
            "boundary",
            "events",
            "bind",
            "pixels",
            "present"
          ]
        }
      }
    },
    "expected": {
      "type": "object"
    }
  }
}
