{
  "id": "MEDUI-PROFILE-CASE-VIEWPORT-RANGE",
  "profile": {
    "id": "MEDUI-PROFILE-BINDING",
    "version": 1
  },
  "rules": [
    "B01",
    "B04"
  ],
  "description": "viewport range",
  "inputs": {
    "operation": "bind",
    "screen": "screen",
    "snapshot": "s1",
    "frame": 1,
    "node": "node",
    "component": "VulkanViewport",
    "declaredSource": "value",
    "value": {
      "width": 1,
      "height": 1,
      "format": "RGBA8",
      "rgba8": [
        256,
        0,
        0,
        255
      ]
    },
    "declaredSize": [
      1,
      1
    ],
    "background": [
      0,
      0,
      100
    ]
  },
  "expected": {
    "valid": false
  }
}
