{
  "id": "MEDUI-PROFILE-CASE-MAPPING-UNKNOWN",
  "profile": {
    "id": "MEDUI-PROFILE-BINDING",
    "version": 1
  },
  "rules": [
    "B01"
  ],
  "description": "mapping unknown",
  "inputs": {
    "operation": "bind",
    "screen": "screen",
    "snapshot": "s1",
    "frame": 1,
    "node": "node",
    "component": "TextInput",
    "declaredSource": "value",
    "value": null,
    "entries": [
      {
        "screen": "screen",
        "node": "unknown",
        "source": "value",
        "snapshot": "s1",
        "value": "ab"
      }
    ],
    "glyphs": [
      "a",
      "b"
    ],
    "maxLength": 4
  },
  "expected": {
    "valid": false,
    "publishedSnapshot": null
  }
}
