{
  "id": "MEDUI-PROFILE-CASE-EDIT-RIGHT",
  "profile": {
    "id": "MEDUI-PROFILE-INTERACTION",
    "version": 1
  },
  "rules": [
    "I06"
  ],
  "description": "edit right",
  "inputs": {
    "operation": "edit",
    "surface": [
      20,
      20
    ],
    "nodes": [
      {
        "id": "text",
        "component": "TextInput",
        "rect": [
          0,
          0,
          10,
          10
        ],
        "clip": [
          0,
          0,
          20,
          20
        ],
        "eligible": true,
        "source": "name"
      }
    ],
    "focused": "text",
    "text": "a\ud83d\ude00b",
    "caret": 1,
    "selection": [
      1,
      1
    ],
    "glyphs": [
      "a",
      "b",
      "\u00e9",
      "\ud83d\ude00"
    ],
    "maxLength": 4,
    "events": [
      {
        "type": "right"
      }
    ]
  },
  "expected": {
    "text": "a\ud83d\ude00b",
    "caret": 2,
    "rejectedEvents": []
  }
}
