{
  "id": "MEDUI-PROFILE-CASE-EXTENT-INSET",
  "profile": {
    "id": "MEDUI-PROFILE-RENDERED",
    "version": 1
  },
  "rules": [
    "R01"
  ],
  "description": "extent inset",
  "inputs": {
    "operation": "rendered-check",
    "check": "extent-equality",
    "golden": [
      2,
      2,
      4,
      4
    ],
    "ink": [
      3,
      3,
      2,
      2
    ]
  },
  "expected": {
    "outcome": "fail"
  }
}
