{
  "id": "MEDUI-PROFILE-CASE-HASH-EMPTY",
  "profile": {
    "id": "MEDUI-PROFILE-RENDERED",
    "version": 1
  },
  "rules": [
    "R04"
  ],
  "description": "hash empty",
  "inputs": {
    "operation": "rendered-check",
    "check": "rgba8-sha256",
    "surface": [
      2,
      2
    ],
    "rgba8": [
      255,
      0,
      0,
      255,
      0,
      255,
      0,
      255,
      0,
      0,
      255,
      255,
      255,
      255,
      255,
      255
    ],
    "golden": [
      0,
      0,
      0,
      0
    ],
    "baseline": "e3b0c44298fc1c149afbf4c8996fb92427ae41e4649b934ca495991b7852b855",
    "captureIdentity": {
      "contract": "aaaaaaaaaaaaaaaaaaaaaaaaaaaaaaaaaaaaaaaa",
      "producer": {
        "name": "fixture",
        "version": "1",
        "source": "bbbbbbbbbbbbbbbbbbbbbbbbbbbbbbbbbbbbbbbb"
      },
      "profile": {
        "id": "MEDUI-PROFILE-RENDERED",
        "version": 1
      },
      "artifact": "cccccccccccccccccccccccccccccccccccccccccccccccccccccccccccccccc",
      "assets": "dddddddddddddddddddddddddddddddddddddddddddddddddddddddddddddddd",
      "screen": "screen",
      "node": "node",
      "locale": null,
      "scenario": "static",
      "capture": "capture",
      "frame": 0,
      "check": {
        "id": "extent-equality",
        "version": 1
      },
      "backend": "synthetic",
      "configuration": "eeeeeeeeeeeeeeeeeeeeeeeeeeeeeeeeeeeeeeeeeeeeeeeeeeeeeeeeeeeeeeee"
    },
    "baselineIdentity": {
      "contract": "aaaaaaaaaaaaaaaaaaaaaaaaaaaaaaaaaaaaaaaa",
      "producer": {
        "name": "fixture",
        "version": "1",
        "source": "bbbbbbbbbbbbbbbbbbbbbbbbbbbbbbbbbbbbbbbb"
      },
      "profile": {
        "id": "MEDUI-PROFILE-RENDERED",
        "version": 1
      },
      "artifact": "cccccccccccccccccccccccccccccccccccccccccccccccccccccccccccccccc",
      "assets": "dddddddddddddddddddddddddddddddddddddddddddddddddddddddddddddddd",
      "screen": "screen",
      "node": "node",
      "locale": null,
      "scenario": "static",
      "capture": "capture",
      "frame": 0,
      "check": {
        "id": "extent-equality",
        "version": 1
      },
      "backend": "synthetic",
      "configuration": "eeeeeeeeeeeeeeeeeeeeeeeeeeeeeeeeeeeeeeeeeeeeeeeeeeeeeeeeeeeeeeee"
    }
  },
  "expected": {
    "outcome": "pass"
  }
}
