{
  "id": "MEDUI-PROFILE-CASE-TINT-ZERO-SPAN-BOUNDARY",
  "profile": {
    "id": "MEDUI-PROFILE-RENDERED",
    "version": 1
  },
  "rules": [
    "R03"
  ],
  "description": "A zero-span channel must remain within the two-composite allowance.",
  "inputs": {
    "operation": "rendered-check",
    "check": "tint-composition",
    "tint": [
      200,
      100,
      0
    ],
    "composites": 2,
    "samples": [
      {
        "background": [
          0,
          0,
          0
        ],
        "rgb": [
          200,
          100,
          2
        ]
      },
      {
        "background": [
          0,
          0,
          0
        ],
        "rgb": [
          200,
          100,
          0
        ]
      }
    ]
  },
  "expected": {
    "outcome": "pass"
  }
}
