{
  "id": "MEDUI-PROFILE-CASE-PIXEL-IDENTITY-SURFACE",
  "profile": {
    "id": "MEDUI-PROFILE-PRESENTATION",
    "version": 1
  },
  "rules": [
    "P03"
  ],
  "description": "pixel identity surface",
  "inputs": {
    "operation": "pixels",
    "captureIdentity": {
      "declaration": "ffffffffffffffffffffffffffffffffffffffffffffffffffffffffffffffff",
      "theme": "aaaaaaaaaaaaaaaaaaaaaaaaaaaaaaaaaaaaaaaaaaaaaaaaaaaaaaaaaaaaaaaa",
      "font": "bbbbbbbbbbbbbbbbbbbbbbbbbbbbbbbbbbbbbbbbbbbbbbbbbbbbbbbbbbbbbbbb",
      "assets": "cccccccccccccccccccccccccccccccccccccccccccccccccccccccccccccccc",
      "backend": "synthetic",
      "surface": [
        1,
        1
      ],
      "locale": null,
      "scenario": "static",
      "frame": 0
    },
    "baselineIdentity": {
      "declaration": "ffffffffffffffffffffffffffffffffffffffffffffffffffffffffffffffff",
      "theme": "aaaaaaaaaaaaaaaaaaaaaaaaaaaaaaaaaaaaaaaaaaaaaaaaaaaaaaaaaaaaaaaa",
      "font": "bbbbbbbbbbbbbbbbbbbbbbbbbbbbbbbbbbbbbbbbbbbbbbbbbbbbbbbbbbbbbbbb",
      "assets": "cccccccccccccccccccccccccccccccccccccccccccccccccccccccccccccccc",
      "backend": "synthetic",
      "surface": [
        10,
        10
      ],
      "locale": null,
      "scenario": "static",
      "frame": 0
    },
    "pixels": [
      0,
      0,
      0,
      255
    ],
    "baselinePixels": [
      0,
      0,
      0,
      255
    ]
  },
  "expected": {
    "outcome": "fail"
  }
}
