{
  "id": "MEDUI-PROFILE-CASE-IDENTITY-SCENARIO",
  "profile": {
    "id": "MEDUI-PROFILE-EVIDENCE",
    "version": 1
  },
  "rules": [
    "E01",
    "E02"
  ],
  "description": "identity scenario",
  "inputs": {
    "operation": "aggregate-evidence",
    "obligations": [
      {
        "contract": "aaaaaaaaaaaaaaaaaaaaaaaaaaaaaaaaaaaaaaaa",
        "producer": {
          "name": "fixture",
          "version": "1",
          "source": "bbbbbbbbbbbbbbbbbbbbbbbbbbbbbbbbbbbbbbbb"
        },
        "profile": {
          "id": "MEDUI-PROFILE-RENDERED",
          "version": 1
        },
        "artifact": "cccccccccccccccccccccccccccccccccccccccccccccccccccccccccccccccc",
        "assets": [
          {
            "id": "font/main",
            "digest": "dddddddddddddddddddddddddddddddddddddddddddddddddddddddddddddddd"
          }
        ],
        "screen": "screen",
        "node": "node",
        "locale": null,
        "scenario": "static",
        "capture": "capture",
        "frame": 0,
        "check": {
          "id": "extent-equality",
          "version": 1
        },
        "backend": "synthetic",
        "configuration": "eeeeeeeeeeeeeeeeeeeeeeeeeeeeeeeeeeeeeeeeeeeeeeeeeeeeeeeeeeeeeeee"
      }
    ],
    "rows": [
      {
        "identity": {
          "contract": "aaaaaaaaaaaaaaaaaaaaaaaaaaaaaaaaaaaaaaaa",
          "producer": {
            "name": "fixture",
            "version": "1",
            "source": "bbbbbbbbbbbbbbbbbbbbbbbbbbbbbbbbbbbbbbbb"
          },
          "profile": {
            "id": "MEDUI-PROFILE-RENDERED",
            "version": 1
          },
          "artifact": "cccccccccccccccccccccccccccccccccccccccccccccccccccccccccccccccc",
          "assets": [
            {
              "id": "font/main",
              "digest": "dddddddddddddddddddddddddddddddddddddddddddddddddddddddddddddddd"
            }
          ],
          "screen": "screen",
          "node": "node",
          "locale": null,
          "scenario": "ffffffffffffffffffffffffffffffffffffffffffffffffffffffffffffffff",
          "capture": "capture",
          "frame": 0,
          "check": {
            "id": "extent-equality",
            "version": 1
          },
          "backend": "synthetic",
          "configuration": "eeeeeeeeeeeeeeeeeeeeeeeeeeeeeeeeeeeeeeeeeeeeeeeeeeeeeeeeeeeeeeee"
        },
        "outcome": "pass"
      }
    ]
  },
  "expected": {
    "outcome": "fail"
  }
}
