{
  "id": "MEDUI-PROFILE-CASE-QUEUE-FULL",
  "profile": {
    "id": "MEDUI-PROFILE-INTERACTION",
    "version": 1
  },
  "rules": [
    "I03",
    "I04"
  ],
  "description": "queue full",
  "inputs": {
    "operation": "events",
    "surface": [
      20,
      20
    ],
    "nodes": [
      {
        "id": "button",
        "component": "Button",
        "rect": [
          0,
          0,
          10,
          10
        ],
        "clip": [
          0,
          0,
          20,
          20
        ],
        "eligible": true,
        "source": "confirm"
      }
    ],
    "capacity": 2,
    "droppedLimit": 3,
    "initialDropped": 0,
    "events": [
      {
        "type": "press",
        "point": [
          2,
          2
        ]
      },
      {
        "type": "release",
        "point": [
          2,
          2
        ]
      }
    ]
  },
  "expected": {
    "outputs": [
      {
        "kind": "source",
        "node": "button",
        "source": "confirm"
      }
    ],
    "armed": null,
    "dropped": 0
  }
}
